"MatchingRule","Record1Identifier","Record2Identifier","TotalSimilarity","IsMatch","[0] SongNameComparatorRemoveBrackets record1Value","[0] SongNameComparatorRemoveBrackets record2Value","[0] SongNameComparatorRemoveBrackets record1PreprocessedValue","[0] SongNameComparatorRemoveBrackets record2PreprocessedValue","[0] SongNameComparatorRemoveBrackets similarity","[0] SongNameComparatorRemoveBrackets postproccesedSimilarity","[1] SongNameComparatorLevenshtein record1Value","[1] SongNameComparatorLevenshtein record2Value","[1] SongNameComparatorLevenshtein record1PreprocessedValue","[1] SongNameComparatorLevenshtein record2PreprocessedValue","[1] SongNameComparatorLevenshtein similarity","[1] SongNameComparatorLevenshtein postproccesedSimilarity","[2] SongArtistsComparatorToken record1Value","[2] SongArtistsComparatorToken record2Value","[2] SongArtistsComparatorToken record1PreprocessedValue","[2] SongArtistsComparatorToken record2PreprocessedValue","[2] SongArtistsComparatorToken similarity","[2] SongArtistsComparatorToken postproccesedSimilarity","[3] SongArtistsComparatorLevenshtein record1Value","[3] SongArtistsComparatorLevenshtein record2Value","[3] SongArtistsComparatorLevenshtein record1PreprocessedValue","[3] SongArtistsComparatorLevenshtein record2PreprocessedValue","[3] SongArtistsComparatorLevenshtein similarity","[3] SongArtistsComparatorLevenshtein postproccesedSimilarity","[4] SongAlbumComparatorMaxSim record1Value","[4] SongAlbumComparatorMaxSim record2Value","[4] SongAlbumComparatorMaxSim record1PreprocessedValue","[4] SongAlbumComparatorMaxSim record2PreprocessedValue","[4] SongAlbumComparatorMaxSim similarity","[4] SongAlbumComparatorMaxSim postproccesedSimilarity","[5] SongAlbumComparatorToken record1Value","[5] SongAlbumComparatorToken record2Value","[5] SongAlbumComparatorToken record1PreprocessedValue","[5] SongAlbumComparatorToken record2PreprocessedValue","[5] SongAlbumComparatorToken similarity","[5] SongAlbumComparatorToken postproccesedSimilarity"
"WekaMatchingRule","dbpedia_448","musicbrainz_29804","0.0028095848479932697",,"Live For","Little Soldier Boy","Live For","Little Soldier Boy","0.33333333333333337","0.33333333333333337","Live For","Little Soldier Boy","Live For","Little Soldier Boy","0.33333333333333337","0.33333333333333337","the weeknd","the yardbirds","the weeknd","the yardbirds","0.3333333333333333","0.3333333333333333","The Weeknd","The Yardbirds","The Weeknd","The Yardbirds","0.3846153846153846","0.3846153846153846","kiss land","little games","kiss land","little games","0.0","0.0","kiss land","little games","kiss land","little games","0.0","0.0"
"WekaMatchingRule","dbpedia_3168","musicbrainz_6396","0.0033766699847865133",,"Don't Swallow the Cap","Don’t Look Back","Don't Swallow the Cap","Don’t Look Back","0.4285714285714286","0.4285714285714286","Don't Swallow the Cap","Don’t Look Back","Don't Swallow the Cap","Don’t Look Back","0.4285714285714286","0.4285714285714286","the national","queensrÿche","the national","queensrÿche","0.0","0.0","The National","Queensrÿche","The National","Queensrÿche","0.16666666666666663","0.16666666666666663","trouble will find me","queensrÿche","trouble will find me","queensrÿche","0.0","0.0","trouble will find me","queensrÿche","trouble will find me","queensrÿche","0.0","0.0"
"WekaMatchingRule","dbpedia_4352","musicbrainz_20266","0.0012458574621582326",,"Alkohola litar","Allergic to Water","Alkohola litar","Allergic to Water","0.2941176470588235","0.2941176470588235","Alkohola litar","Allergic to Water","Alkohola litar","Allergic to Water","0.2941176470588235","0.2941176470588235","elitni odredi","ani difranco","elitni odredi","ani difranco","0.0","0.0","Elitni Odredi","Ani DiFranco","Elitni Odredi","Ani DiFranco","0.15384615384615385","0.15384615384615385",,,,,,,"","allergic to water","","allergic to water","0.0","0.0"
"WekaMatchingRule","dbpedia_6066","musicbrainz_31478","0.004386292611244325",,"We No Who U R","We Want to Be It","We No Who U R","We Want to Be It","0.4375","0.4375","We No Who U R","We Want to Be It","We No Who U R","We Want to Be It","0.4375","0.4375","nick cave and the bad seeds","the tragically hip","nick cave and the bad seeds","the tragically hip","0.125","0.125","Nick Cave and the Bad Seeds","The Tragically Hip","Nick Cave and the Bad Seeds","The Tragically Hip","0.11111111111111116","0.11111111111111116","push the sky away","now for plan a","push the sky away","now for plan a","0.0","0.0","push the sky away","now for plan a","push the sky away","now for plan a","0.0","0.0"
"WekaMatchingRule","dbpedia_8241","musicbrainz_360","0.0018558646685932247",,"The Mother We Share","The World Belongs to Me","The Mother We Share","The World Belongs to Me","0.34782608695652173","0.34782608695652173","The Mother We Share","The World Belongs to Me","The Mother We Share","The World Belongs to Me","0.34782608695652173","0.34782608695652173","chvrches","my darkest days","chvrches","my darkest days","0.0","0.0","Chvrches","My Darkest Days","Chvrches","My Darkest Days","0.1333333333333333","0.1333333333333333","the bones of what you believe","my darkest days","the bones of what you believe","my darkest days","0.0","0.0","the bones of what you believe","my darkest days","the bones of what you believe","my darkest days","0.0","0.0"
"WekaMatchingRule","dbpedia_954","musicbrainz_6915","8.219418008864284E-4",,"Weekends ","We Share the Same Sun","Weekends ","We Share the Same Sun","0.23809523809523814","0.23809523809523814","Weekends (Skrillex song)","We Share the Same Sun","Weekends (Skrillex song)","We Share the Same Sun","0.29166666666666663","0.29166666666666663","skrillex","stereophonics","skrillex","stereophonics","0.0","0.0","Skrillex","Stereophonics","Skrillex","Stereophonics","0.15384615384615385","0.15384615384615385","my name is skrillex","graffiti on the train","my name is skrillex","graffiti on the train","0.0","0.0","my name is skrillex","graffiti on the train","my name is skrillex","graffiti on the train","0.0","0.0"
"WekaMatchingRule","dbpedia_1342","musicbrainz_10503","7.933859303397422E-4",,"The Hellcat Spangled Shalalala","The Few, the Proud, the Broken","The Hellcat Spangled Shalalala","The Few, the Proud, the Broken","0.23333333333333328","0.23333333333333328","The Hellcat Spangled Shalalala","The Few, the Proud, the Broken","The Hellcat Spangled Shalalala","The Few, the Proud, the Broken","0.23333333333333328","0.23333333333333328","arctic monkeys","kreator","arctic monkeys","kreator","0.0","0.0","Arctic Monkeys","Kreator","Arctic Monkeys","Kreator","0.1428571428571429","0.1428571428571429","suck it and see","phantom antichrist","suck it and see","phantom antichrist","0.0","0.0","suck it and see","phantom antichrist","suck it and see","phantom antichrist","0.0","0.0"
"WekaMatchingRule","dbpedia_2247","musicbrainz_32564","0.001666684658250524",,"Gold ","Goin Down","Gold ","Goin Down","0.33333333333333337","0.33333333333333337","Gold (Neon Hitch song)","Goin Down","Gold (Neon Hitch song)","Goin Down","0.2272727272727273","0.2272727272727273","neon hitch","dinosaur jr.","neon hitch","dinosaur jr.","0.0","0.0","Neon Hitch","Dinosaur Jr.","Neon Hitch","Dinosaur Jr.","0.08333333333333337","0.08333333333333337",,,,,,,"","give a glimpse of what yer not","","give a glimpse of what yer not","0.0","0.0"
"WekaMatchingRule","dbpedia_5526","musicbrainz_15244","0.003091650124121141",,"The Rocky Road to Poland","The Odd Couple","The Rocky Road to Poland","The Odd Couple","0.41666666666666663","0.41666666666666663","The Rocky Road to Poland","The Odd Couple","The Rocky Road to Poland","The Odd Couple","0.41666666666666663","0.41666666666666663","damien dempsey","weezer","damien dempsey","weezer","0.0","0.0","Damien Dempsey","Weezer","Damien Dempsey","Weezer","0.2142857142857143","0.2142857142857143",,,,,,,"","death to false metal","","death to false metal","0.0","0.0"
"WekaMatchingRule","dbpedia_7846","musicbrainz_1510",,"0","High Five, Swan Dive, Nose Dive","Wildfire, Smoke & Doom","High Five, Swan Dive, Nose Dive","Wildfire, Smoke & Doom","0.3548387096774194","0.3548387096774194","High Five, Swan Dive, Nose Dive","Wildfire, Smoke & Doom","High Five, Swan Dive, Nose Dive","Wildfire, Smoke & Doom","0.3548387096774194","0.3548387096774194","pulled apart by horses","pulled apart by horses","pulled apart by horses","pulled apart by horses","1.0","1.0","Pulled Apart By Horses","Pulled Apart by Horses","Pulled Apart By Horses","Pulled Apart by Horses","1.0","1.0","pulled apart by horses","tough love","pulled apart by horses","tough love","0.0","0.0","pulled apart by horses","tough love","pulled apart by horses","tough love","0.0","0.0"
"WekaMatchingRule","dbpedia_1956","musicbrainz_4037","0.0010357087825174428",,"This Is What It Feels Like","The Moon / Awake","This Is What It Feels Like","The Moon / Awake","0.2692307692307693","0.2692307692307693","This Is What It Feels Like","The Moon / Awake","This Is What It Feels Like","The Moon / Awake","0.2692307692307693","0.2692307692307693","jason benoit","the dear hunter","jason benoit","the dear hunter","0.0","0.0","Jason Benoit","The Dear Hunter","Jason Benoit","The Dear Hunter","0.1333333333333333","0.1333333333333333","intense","act v: hymns with the devil in confessional","intense","act v: hymns with the devil in confessional","0.0","0.0","intense","act v: hymns with the devil in confessional","intense","act v: hymns with the devil in confessional","0.0","0.0"
"WekaMatchingRule","dbpedia_4383","musicbrainz_8084","0.06761471599080768","0","Save Today","Same Damn Life","Save Today","Same Damn Life","0.2857142857142857","0.2857142857142857","Save Today","Same Damn Life","Save Today","Same Damn Life","0.2857142857142857","0.2857142857142857","seether","seether","seether","seether","1.0","1.0","Seether","Seether","Seether","Seether","1.0","1.0","isolate and medicate","isolate and medicate","isolate and medicate","isolate and medicate","1.0","1.0","isolate and medicate","isolate and medicate","isolate and medicate","isolate and medicate","1.0","1.0"
"WekaMatchingRule","dbpedia_10881","musicbrainz_12212","4.0517485361487096E-4",,"Hell Naw","Heavydirtysoul","Hell Naw","Heavydirtysoul","0.1428571428571429","0.1428571428571429","Hell Naw","Heavydirtysoul","Hell Naw","Heavydirtysoul","0.1428571428571429","0.1428571428571429","nasty c","twenty one pilots","nasty c","twenty one pilots","0.0","0.0","Nasty C","twenty one pilots","Nasty C","twenty one pilots","0.17647058823529416","0.17647058823529416","bad hair","blurryface","bad hair","blurryface","0.0","0.0","bad hair","blurryface","bad hair","blurryface","0.0","0.0"
"WekaMatchingRule","dbpedia_9437","musicbrainz_8345","0.0018860337181110997",,"The Charade ","The Devil Inside You","The Charade ","The Devil Inside You","0.35","0.35","The Charade (song)","The Devil Inside You","The Charade (song)","The Devil Inside You","0.25","0.25","serj tankian","our last night","serj tankian","our last night","0.0","0.0","Serj Tankian","Our Last Night","Serj Tankian","Our Last Night","0.2142857142857143","0.2142857142857143","elect the dead symphony","we will all evolve","elect the dead symphony","we will all evolve","0.0","0.0","elect the dead symphony","we will all evolve","elect the dead symphony","we will all evolve","0.0","0.0"
"WekaMatchingRule","dbpedia_4892","musicbrainz_12452","7.305515048156064E-4",,"On Melancholy Hill","One Step Closer","On Melancholy Hill","One Step Closer","0.2222222222222222","0.2222222222222222","On Melancholy Hill","One Step Closer","On Melancholy Hill","One Step Closer","0.2222222222222222","0.2222222222222222","gorillaz","linkin park","gorillaz","linkin park","0.0","0.0","Gorillaz","Linkin Park","Gorillaz","Linkin Park","0.18181818181818177","0.18181818181818177","plastic beach","the hunting party,living things +","plastic beach","the hunting party,living things +","0.0","0.0","plastic beach","the hunting party,living things +","plastic beach","the hunting party,living things +","0.0","0.0"
"WekaMatchingRule","dbpedia_10212","musicbrainz_33195","0.002981380191028734",,"Bullet ","Bullet From a Gun","Bullet ","Bullet From a Gun","0.4117647058823529","0.4117647058823529","Bullet (Rokelle song)","Bullet From a Gun","Bullet (Rokelle song)","Bullet From a Gun","0.5238095238095238","0.5238095238095238","rokelle","the script","rokelle","the script","0.0","0.0","Rokelle","The Script","Rokelle","The Script","0.0","0.0",,,,,,,"","science & faith","","science & faith","0.0","0.0"
"WekaMatchingRule","dbpedia_5468","musicbrainz_19156","0.001666684658250524",,"One More Try ","Only A Matter Of Time","One More Try ","Only A Matter Of Time","0.33333333333333337","0.33333333333333337","One More Try (George Michael song)","Only A Matter Of Time","One More Try (George Michael song)","Only A Matter Of Time","0.23529411764705888","0.23529411764705888","george michael","dream theater","george michael","dream theater","0.0","0.0","George Michael","Dream Theater","George Michael","Dream Theater","0.2857142857142857","0.2857142857142857","faith,soul uk,soul uk – the remixes","when dream and day unite","faith,soul uk,soul uk – the remixes","when dream and day unite","0.0","0.0","faith,soul uk,soul uk – the remixes","when dream and day unite","faith,soul uk,soul uk – the remixes","when dream and day unite","0.0","0.0"
"WekaMatchingRule","dbpedia_3939","musicbrainz_20249","0.0014894612586122756",,"When We Stand Together","Where I Live","When We Stand Together","Where I Live","0.31818181818181823","0.31818181818181823","When We Stand Together","Where I Live","When We Stand Together","Where I Live","0.31818181818181823","0.31818181818181823","nickelback","woodkid","nickelback","woodkid","0.0","0.0","Nickelback","Woodkid","Nickelback","Woodkid","0.0","0.0","here and now","the golden age","here and now","the golden age","0.0","0.0","here and now","the golden age","here and now","the golden age","0.0","0.0"
"WekaMatchingRule","dbpedia_4838","musicbrainz_2912","0.001666684658250524",,"Main Rahoon Ya Na Rahoon","Man / Bag of Sand","Main Rahoon Ya Na Rahoon","Man / Bag of Sand","0.33333333333333337","0.33333333333333337","Main Rahoon Ya Na Rahoon","Man / Bag of Sand","Main Rahoon Ya Na Rahoon","Man / Bag of Sand","0.33333333333333337","0.33333333333333337","armaan malik","frightened rabbit","armaan malik","frightened rabbit","0.0","0.0","Armaan Malik","Frightened Rabbit","Armaan Malik","Frightened Rabbit","0.2941176470588235","0.2941176470588235",,,,,,,"","the winter of mixed drinks","","the winter of mixed drinks","0.0","0.0"
"WekaMatchingRule","dbpedia_2111","musicbrainz_23141","0.0011705214527068823",,"There's No Going Back","The Third Hoorah ","There's No Going Back","The Third Hoorah ","0.2857142857142857","0.2857142857142857","There's No Going Back","The Third Hoorah (orchestral version) (2014 stereo mix)","There's No Going Back","The Third Hoorah (orchestral version) (2014 stereo mix)","0.18181818181818177","0.18181818181818177","sick puppies","jethro tull","sick puppies","jethro tull","0.0","0.0","Sick Puppies","Jethro Tull","Sick Puppies","Jethro Tull","0.0","0.0","connect","warchild","connect","warchild","0.0","0.0","connect","warchild","connect","warchild","0.0","0.0"
"WekaMatchingRule","dbpedia_3359","musicbrainz_21544","0.0024379787913273256",,"Burning House","Bungalow ","Burning House","Bungalow ","0.3846153846153846","0.3846153846153846","Burning House","Bungalow (5.1 mix)","Burning House","Bungalow (5.1 mix)","0.16666666666666663","0.16666666666666663","cam","xtc","cam","xtc","0.0","0.0","Cam","XTC","Cam","XTC","0.0","0.0","untamed","nonsuch","untamed","nonsuch","0.0","0.0","untamed","nonsuch","untamed","nonsuch","0.0","0.0"
"WekaMatchingRule","dbpedia_4868","musicbrainz_6132","0.010252232778413545","0","Cryin' Like a Bitch","Cry Like a Ghost","Cryin' Like a Bitch","Cry Like a Ghost","0.5789473684210527","0.5789473684210527","Cryin' Like a Bitch","Cry Like a Ghost","Cryin' Like a Bitch","Cry Like a Ghost","0.5789473684210527","0.5789473684210527","godsmack","passion pit","godsmack","passion pit","0.0","0.0","Godsmack","Passion Pit","Godsmack","Passion Pit","0.09090909090909094","0.09090909090909094","the oracle","gossamer","the oracle","gossamer","0.0","0.0","the oracle","gossamer","the oracle","gossamer","0.0","0.0"
"WekaMatchingRule","dbpedia_4572","musicbrainz_12240","0.01196773992674415","0","In God's Time","In Another Time","In God's Time","In Another Time","0.6","0.6","In God's Time","In Another Time","In God's Time","In Another Time","0.6","0.6","randy houser","even","randy houser","even","0.0","0.0","Randy Houser","Even","Randy Houser","Even","0.08333333333333337","0.08333333333333337",,,,,,,"","in another time","","in another time","0.0","0.0"
"WekaMatchingRule","dbpedia_9587","musicbrainz_25321","0.0011705214527068823",,"Rocket to Uranus","Roots of the Mountain","Rocket to Uranus","Roots of the Mountain","0.2857142857142857","0.2857142857142857","Rocket to Uranus","Roots of the Mountain","Rocket to Uranus","Roots of the Mountain","0.2857142857142857","0.2857142857142857","vengaboys","enslaved","vengaboys","enslaved","0.0","0.0","Vengaboys","Enslaved","Vengaboys","Enslaved","0.2222222222222222","0.2222222222222222",,,,,,,"","riitiir","","riitiir","0.0","0.0"
"WekaMatchingRule","dbpedia_2830","musicbrainz_29933","0.0031937542877436224",,"My Dark Place Alone","My Heart Explodes","My Dark Place Alone","My Heart Explodes","0.42105263157894735","0.42105263157894735","My Dark Place Alone","My Heart Explodes","My Dark Place Alone","My Heart Explodes","0.42105263157894735","0.42105263157894735","murderdolls","bowling for soup","murderdolls","bowling for soup","0.0","0.0","Murderdolls","Bowling for Soup","Murderdolls","Bowling for Soup","0.125","0.125","women and children last","bowling for soup presents: one big happy!","women and children last","bowling for soup presents: one big happy!","0.0","0.0","women and children last","bowling for soup presents: one big happy!","women and children last","bowling for soup presents: one big happy!","0.0","0.0"
"WekaMatchingRule","dbpedia_3202","musicbrainz_9707","0.892129522743605","1","Here with Me ","Here With Me","Here with Me ","Here With Me","0.9230769230769231","0.9230769230769231","Here with Me (The Killers song)","Here With Me","Here with Me (The Killers song)","Here With Me","0.3870967741935484","0.3870967741935484","the killers","the killers","the killers","the killers","1.0","1.0","The Killers","The Killers","The Killers","The Killers","1.0","1.0","battle born","battle born","battle born","battle born","1.0","1.0","battle born","battle born","battle born","battle born","1.0","1.0"
"WekaMatchingRule","dbpedia_1898","musicbrainz_28907","5.548692259781944E-4",,"Gold Slugs","God Rest Ye Merry Gentlemen","Gold Slugs","God Rest Ye Merry Gentlemen","0.18518518518518523","0.18518518518518523","Gold Slugs","God Rest Ye Merry Gentlemen","Gold Slugs","God Rest Ye Merry Gentlemen","0.18518518518518523","0.18518518518518523","dj khaled","bad religion","dj khaled","bad religion","0.0","0.0","DJ Khaled","Bad Religion","DJ Khaled","Bad Religion","0.08333333333333337","0.08333333333333337","i changed a lot","christmas songs","i changed a lot","christmas songs","0.0","0.0","i changed a lot","christmas songs","i changed a lot","christmas songs","0.0","0.0"
"WekaMatchingRule","dbpedia_6176","musicbrainz_18034","0.004092675580218444",,"The Island ","The Puzzle ","The Island ","The Puzzle ","0.4545454545454546","0.4545454545454546","The Island (Pendulum song)","The Puzzle (Big Chocolate remix)","The Island (Pendulum song)","The Puzzle (Big Chocolate remix)","0.28125","0.28125","pendulum","in flames","pendulum","in flames","0.0","0.0","Pendulum","In Flames","Pendulum","In Flames","0.2222222222222222","0.2222222222222222","immersion","sounds of a playground fading","immersion","sounds of a playground fading","0.0","0.0","immersion","sounds of a playground fading","immersion","sounds of a playground fading","0.0","0.0"
"WekaMatchingRule","dbpedia_6054","musicbrainz_21847","0.0012458574621582326",,"Lonely Christmas ","Love Killer","Lonely Christmas ","Love Killer","0.2941176470588235","0.2941176470588235","Lonely Christmas (Crayon Pop song)","Love Killer","Lonely Christmas (Crayon Pop song)","Love Killer","0.17647058823529416","0.17647058823529416","crayon pop","this century","crayon pop","this century","0.0","0.0","Crayon Pop","This Century","Crayon Pop","This Century","0.08333333333333337","0.08333333333333337",,,,,,,"","biography of heartbreak","","biography of heartbreak","0.0","0.0"
"WekaMatchingRule","dbpedia_533","musicbrainz_11760","0.001103553823662557",,"The Fox ","Thela Hun Ginjeet ","The Fox ","Thela Hun Ginjeet ","0.2777777777777778","0.2777777777777778","The Fox (What Does the Fox Say?)","Thela Hun Ginjeet (rough mix)","The Fox (What Does the Fox Say?)","Thela Hun Ginjeet (rough mix)","0.21875","0.21875","ylvis","king crimson","ylvis","king crimson","0.0","0.0","Ylvis","King Crimson","Ylvis","King Crimson","0.16666666666666663","0.16666666666666663",,,,,,,"","discipline","","discipline","0.0","0.0"
"WekaMatchingRule","dbpedia_6970","musicbrainz_24136","0.001666684658250524",,"Someone Wake Me Up","Sooner Than Later","Someone Wake Me Up","Sooner Than Later","0.33333333333333337","0.33333333333333337","Someone Wake Me Up","Sooner Than Later","Someone Wake Me Up","Sooner Than Later","0.33333333333333337","0.33333333333333337","joe mcelderry","sixpence none the richer","joe mcelderry","sixpence none the richer","0.0","0.0","Joe McElderry","Sixpence None the Richer","Joe McElderry","Sixpence None the Richer","0.20833333333333337","0.20833333333333337","the chronicles of narnia: the voyage of the dawn treader,wide awake","lost in transition","the chronicles of narnia: the voyage of the dawn treader,wide awake","lost in transition","0.0","0.0","the chronicles of narnia: the voyage of the dawn treader,wide awake","lost in transition","the chronicles of narnia: the voyage of the dawn treader,wide awake","lost in transition","0.0","0.0"
"WekaMatchingRule","dbpedia_8244","musicbrainz_18375",,"0","When the Night Falls Quiet","In the Veins of Death Valley","When the Night Falls Quiet","In the Veins of Death Valley","0.2857142857142857","0.2857142857142857","When the Night Falls Quiet","In the Veins of Death Valley","When the Night Falls Quiet","In the Veins of Death Valley","0.2857142857142857","0.2857142857142857","birds of tokyo","birds of tokyo","birds of tokyo","birds of tokyo","1.0","1.0","Birds of Tokyo","Birds of Tokyo","Birds of Tokyo","Birds of Tokyo","1.0","1.0","march fires","birds of tokyo","march fires","birds of tokyo","0.0","0.0","march fires","birds of tokyo","march fires","birds of tokyo","0.0","0.0"
"WekaMatchingRule","dbpedia_5526","musicbrainz_7844","0.001666684658250524",,"The Rocky Road to Poland","The Portal","The Rocky Road to Poland","The Portal","0.33333333333333337","0.33333333333333337","The Rocky Road to Poland","The Portal","The Rocky Road to Poland","The Portal","0.33333333333333337","0.33333333333333337","damien dempsey","burzum","damien dempsey","burzum","0.0","0.0","Damien Dempsey","Burzum","Damien Dempsey","Burzum","0.0714285714285714","0.0714285714285714",,,,,,,"","the ways of yore","","the ways of yore","0.0","0.0"
"WekaMatchingRule","dbpedia_10693","musicbrainz_2978","9.900505877907476E-4",,"Stand Proud","Starts With Nothing","Stand Proud","Starts With Nothing","0.26315789473684215","0.26315789473684215","Stand Proud","Starts With Nothing","Stand Proud","Starts With Nothing","0.26315789473684215","0.26315789473684215","jin hashimoto","kaiser chiefs","jin hashimoto","kaiser chiefs","0.0","0.0","Jin Hashimoto","Kaiser Chiefs","Jin Hashimoto","Kaiser Chiefs","0.15384615384615385","0.15384615384615385",,,,,,,"","the future is medieval","","the future is medieval","0.0","0.0"
"WekaMatchingRule","dbpedia_188","musicbrainz_13423","4.835633178021515E-4",,"Linger ","Light Up the Night","Linger ","Light Up the Night","0.16666666666666663","0.16666666666666663","Linger (Guy Sebastian song)","Light Up the Night","Linger (Guy Sebastian song)","Light Up the Night","0.2962962962962963","0.2962962962962963","guy sebastian","symphony x","guy sebastian","symphony x","0.0","0.0","Guy Sebastian","Symphony X","Guy Sebastian","Symphony X","0.07692307692307687","0.07692307692307687","madness","iconoclast","madness","iconoclast","0.0","0.0","madness","iconoclast","madness","iconoclast","0.0","0.0"
"WekaMatchingRule","dbpedia_2526","musicbrainz_20512","0.0013779167127656612",,"Crush on You ","Cruel Mother","Crush on You ","Cruel Mother","0.3076923076923077","0.3076923076923077","Crush on You (Nero song)","Cruel Mother","Crush on You (Nero song)","Cruel Mother","0.29166666666666663","0.29166666666666663","nero","graham coxon","nero","graham coxon","0.0","0.0","Nero","Graham Coxon","Nero","Graham Coxon","0.08333333333333337","0.08333333333333337","welcome reality","shirley inspired...","welcome reality","shirley inspired...","0.0","0.0","welcome reality","shirley inspired...","welcome reality","shirley inspired...","0.0","0.0"
"WekaMatchingRule","dbpedia_3745","musicbrainz_32758","0.0014894612586122756",,"The High Road ","The Stutter Says a Lot","The High Road ","The Stutter Says a Lot","0.31818181818181823","0.31818181818181823","The High Road (Three Days Grace song)","The Stutter Says a Lot","The High Road (Three Days Grace song)","The Stutter Says a Lot","0.3783783783783784","0.3783783783783784","three days grace","saosin","three days grace","saosin","0.0","0.0","Three Days Grace","Saosin","Three Days Grace","Saosin","0.125","0.125","transit of venus","along the shadow","transit of venus","along the shadow","0.0","0.0","transit of venus","along the shadow","transit of venus","along the shadow","0.0","0.0"
